{
  "catalog_version": "0.5.0",
  "catalog_schema": "open-source-patterns.schema.json",
  "retrieved": "2026-09-24",
  "eligibility_policy": {
    "allowed_licenses": [
      "MIT",
      "Apache-2.0"
    ],
    "code_copied": false,
    "rule": "Use eligible projects to study architecture and behavior boundaries; record provenance before adapting any implementation detail."
  },
  "sources": [
    {
      "id": "apache-commons-math",
      "name": "Apache Commons Math 3.6.1",
      "repository": "https://github.com/apache/commons-math",
      "license_evidence_url": "https://github.com/apache/commons-math/blob/MATH_3_6_1/LICENSE.txt",
      "licenses": [
        "Apache-2.0"
      ],
      "reference_urls": [
        "https://github.com/apache/commons-math/blob/MATH_3_6_1/src/main/java/org/apache/commons/math3/util/ArithmeticUtils.java",
        "https://github.com/apache/commons-math/blob/MATH_3_6_1/src/main/java/org/apache/commons/math3/util/CombinatoricsUtils.java"
      ],
      "scope_note": "Apache-2.0 references for binomial coefficients, symmetry reduction, Euclidean GCD, divide-before-multiply LCM construction, trivial cases, and floating-point overflow behavior. Used for architectural/numeric-pattern comparison only; no source code is copied and no dependency is added."
    },
    {
      "id": "apache-openoffice",
      "name": "Apache OpenOffice",
      "repository": "https://github.com/apache/openoffice",
      "license_evidence_url": "https://www.openoffice.org/license.html",
      "licenses": [
        "Apache-2.0"
      ],
      "reference_urls": [
        "https://github.com/apache/openoffice/blob/trunk/main/scaddins/source/analysis/analysishelper.cxx"
      ],
      "scope_note": "Independent AMORDEGRC implementation comparison under Apache-2.0. It differs from ExcelFinancialFunctions in coefficient-band selection and validation; use as a divergence probe, not an Excel oracle. No source code is copied."
    },
    {
      "id": "apache-poi",
      "name": "Apache POI",
      "repository": "https://github.com/apache/poi",
      "license_evidence_url": "https://github.com/apache/poi/blob/trunk/legal/LICENSE",
      "licenses": [
        "Apache-2.0"
      ],
      "reference_urls": [
        "https://poi.apache.org/apidocs/dev/org/apache/poi/xssf/usermodel/XSSFFormulaEvaluator.html",
        "https://poi.apache.org/apidocs/dev/org/apache/poi/ss/usermodel/FormulaEvaluator.html",
        "https://github.com/apache/poi/blob/dfa955921c773ac56bc09534214ca7e61aa74d47/poi/src/main/java/org/apache/poi/ss/formula/atp/WorkdayCalculator.java",
        "https://github.com/apache/poi/blob/trunk/poi/src/main/java/org/apache/poi/ss/formula/functions/Days360.java",
        "https://github.com/apache/poi/blob/trunk/poi/src/main/java/org/apache/poi/ss/formula/atp/YearFracCalculator.java"
      ],
      "scope_note": "Reference for formula-evaluator cache invalidation, WorkdayCalculator separation of weekend selection, weekday classification, and holiday exclusion, and the structure of US/European 30/360 and YEARFRAC basis selection. Apache POI is an architecture/behavior comparison, not an Excel oracle for undocumented cases. No source code is copied."
    },
    {
      "id": "excel-financial-functions",
      "name": "ExcelFinancialFunctions",
      "repository": "https://github.com/fsprojects/ExcelFinancialFunctions",
      "license_evidence_url": "https://github.com/fsprojects/ExcelFinancialFunctions/blob/master/LICENSE.txt",
      "licenses": [
        "Apache-2.0"
      ],
      "reference_urls": [
        "https://github.com/fsprojects/ExcelFinancialFunctions/blob/master/src/ExcelFinancialFunctions/daycountbasis.fs",
        "https://fsprojects.github.io/ExcelFinancialFunctions/compatibility.html",
        "https://github.com/fsprojects/ExcelFinancialFunctions/blob/master/src/ExcelFinancialFunctions/tvm.fs",
        "https://github.com/fsprojects/ExcelFinancialFunctions/blob/master/src/ExcelFinancialFunctions/loan.fs",
        "https://github.com/fsprojects/ExcelFinancialFunctions/blob/master/src/ExcelFinancialFunctions/depreciation.fs",
        "https://github.com/fsprojects/ExcelFinancialFunctions/blob/master/tests/ExcelFinancialFunctions.Tests/testdata/sln.test",
        "https://github.com/fsprojects/ExcelFinancialFunctions/blob/master/tests/ExcelFinancialFunctions.Tests/testdata/syd.test",
        "https://github.com/fsprojects/ExcelFinancialFunctions/blob/master/tests/ExcelFinancialFunctions.Tests/testdata/vdb.test",
        "https://github.com/fsprojects/ExcelFinancialFunctions/blob/master/tests/ExcelFinancialFunctions.Tests/testdata/amorlinc.test",
        "https://github.com/fsprojects/ExcelFinancialFunctions/blob/master/tests/ExcelFinancialFunctions.Tests/testdata/amordegrc.test",
        "https://fsprojects.github.io/ExcelFinancialFunctions/compatibility.html#amordegrc"
      ],
      "scope_note": "Reference for periodic growth and annuity factors, period-count inversion, payment-component decomposition, coupon-date generation, basis-specific calculations, and depreciation kernels separated from function-specific validation. Its behavior is a compatibility comparison, not an Excel oracle for undocumented cases. AMORLINC period indexing/day-count and AMORDEGRC rounding/terminal rules are implementation probes; its AMORDEGRC compatibility note records a one-unit rounding discrepancy. VDB split fractional intervals are also a documented compatibility warning. No source code is copied."
    },
    {
      "id": "formualizer",
      "name": "Formualizer",
      "repository": "https://github.com/PSU3D0/formualizer",
      "license_evidence_url": "https://github.com/PSU3D0/formualizer/blob/v0.7.0/LICENSE-MIT",
      "licenses": [
        "MIT",
        "Apache-2.0"
      ],
      "reference_urls": [
        "https://github.com/PSU3D0/formualizer/releases/tag/v0.7.0",
        "https://github.com/PSU3D0/formualizer/blob/v0.7.0/bindings/python/README.md",
        "https://github.com/PSU3D0/formualizer/blob/v0.7.0/crates/formualizer-eval/src/builtins/financial/depreciation.rs",
        "https://github.com/PSU3D0/formualizer/blob/43483d4/crates/formualizer-eval/src/builtins/lookup/dynamic.rs",
        "https://github.com/PSU3D0/formualizer/blob/491f91d/crates/formualizer-eval/src/engine/eval.rs",
        "https://github.com/PSU3D0/formualizer/blob/v0.7.0/crates/formualizer-workbook/tests/spill_circ_teardown.rs",
        "https://github.com/PSU3D0/formualizer/blob/v0.7.0/LICENSE-MIT",
        "https://github.com/PSU3D0/formualizer/blob/v0.7.0/LICENSE-APACHE"
      ],
      "scope_note": "Reference for layered spreadsheet architecture, dependency-aware calculation, language bindings, and dynamic arrays. The pinned v0.7.0 dynamic-function code checks row, column, total-cell and multiplication bounds before allocation; its evaluation code and spill-cycle regression cover cleanup of prior spill projections. MIT and Apache-2.0 license texts are pinned for that release. Architecture reference only; no source code is copied."
    }
  ],
  "patterns": [
    {
      "id": "apache-commons-math-euclidean-gcd-lcm",
      "source_refs": [
        "apache-commons-math"
      ],
      "observation": "ArithmeticUtils uses Euclidean remainder steps for GCD and divides by the GCD before multiplying when forming an LCM.",
      "formula_atlas_decision": "Implement independent language-native Euclidean loops and check the Microsoft LCM result boundary before multiplication; preserve unresolved Excel behavior as explicit profiles.",
      "next_application": "Reuse this pattern for other bounded integer-math families only when their documented input and output limits are separately specified.",
      "code_copied": false
    },
    {
      "id": "array-value-and-spill-projection-boundary",
      "source_refs": [
        "formualizer"
      ],
      "observation": "Pinned Formualizer v0.7.0 checks SEQUENCE/RANDARRAY row, column, total-cell and multiplication bounds before allocation. Its calculation-cycle handling and regression test separately clear stale spill projections and region reservations.",
      "formula_atlas_decision": "Return validated rectangular formula values from the evaluator; a future workbook layer owns spill projection, blockers, grid coordinates and cleanup. The local result cap is 100000 cells. FILTER selection now returns a bounded ArrayValue while spill projection remains separate. No third-party code is copied.",
      "next_application": "Use the same result/projection boundary for SORT, UNIQUE, RANDARRAY, spill references, and dynamic-array recalculation. Treat the pinned Formualizer FILTER implementation as an architecture comparison, not a full semantics oracle.",
      "code_copied": false
    },
    {
      "id": "business-calendar-weekend-mask",
      "source_refs": [
        "apache-poi"
      ],
      "observation": "Keep weekend selection, weekday classification, holiday exclusion, and working-day range counts as distinct steps so one calendar rule can serve both date-count and date-shift functions.",
      "formula_atlas_decision": "Adopt the separation with an explicit Monday-first mask and a bounded binary search for date shifts. Microsoft documentation, not POI behavior, defines the Excel contract. No source code is copied.",
      "next_application": "Reuse the mask and count primitives for future business-calendar formula families while keeping function-specific error rules at dispatch boundaries.",
      "code_copied": false
    },
    {
      "id": "coupon-schedule-derived-outputs",
      "source_refs": [
        "excel-financial-functions"
      ],
      "observation": "A shared maturity-anchored coupon schedule can provide previous and next dates and remaining coupon count, while each formula applies its own basis-specific output calculation.",